17,The Butcher Shop,(3 Reviews),"5255 Kearny Villa Rd, San Diego, CA 92123",(858) 565-2272,21,http://www.butchershopsandiego.com; http://www.butchershopsandiego.com; ,Mashour@butchershopsteakhouse.com; ,"Butcher Shop Steakhouse has been owned and operated by International Aero Clubs since 1998. Modeled after Chicago-style steakhouses, it features a variety of steaks and chops charbroiled on a mesquite grill. The restaurant s menu also includes veal and chicken dishes, Australian-style lobster tail, king crab legs and shrimp. It also serves a selection of appetizers, soups, salads, sandwiches, entrees, seafood and pasta. Butcher Shop Steakhouse s bar offers cigars and several types of wines, such as chardonnay, white zinfandel, cabernet sauvignon, merlot, pinot grigio, sauvignon blanc, Shiraz, Chianti and pinot noir. It has a seating capacity of up to 200 people and organizes several special events, including wedding rehearsal dinners, receptions, corporate events, board meetings, private parties and family gatherings. Butcher Shop Steakhouse is located in San Diego.",Mon - Fri: 11:00 am - 9:30 pm; Sat: 4:00 pm - 10:30 pm; Sun: 4:00 pm - 9:30 pm; ,"amex, discover, master card, visa, diners club, all major credit cards","Steak Houses, American Restaurants, Banquet Halls & Reception Facilities, Bar & Grills, Caterers, Family Style Restaurants, Restaurants, Seafood Restaurants ",Meetings|Receptions|Restaurants|Wedding Ceremonies|Weddings|,"Kearny Mesa, Eastern San Diego",,"Good For Groups: Yes;Cuisines: Caterers, American, Family Style, Seafood, Steakhouse, Bar & Grills;Alcohol: Yes, Full Bar, Wine;Specialties: American Restaurant, Holiday Parties, Cocktail Parties, Weddings, Cocktails, Patriotic, American Food, Club Events, American, Parks, Bridal Events, Wedding Events, Restaurants / Cafes;Price Range : Average;"
18,Athens Market Cafe,(1 Review),"11640 Carmel Mountain Rd, San Diego, CA 92128",(858) 675-2225,25,http://www.athensmarketcafe.com; http://www.athensmarketcafe.com; ,,,Mon - Sun: 11:00 am - 9:00 pm; ,"visa, amex, mastercard, discover","American Restaurants, Caterers, Greek Restaurants, Mediterranean Restaurants, Restaurants ",,"Carmel Mountain, Northeastern San Diego",,"Cuisines: Mediterranean, Caterers, Greek, American, European, Continental;Attire: Casual;Wi-Fi: Free;Bike Parking: Yes;Wheelchair Accessible: Yes;Parking: Lot, Private;Outdoor Seating: Yes;Takes Reservations: Yes;"
19,World Famous,(14 Reviews),"711 Pacific Beach Dr, San Diego, CA 92109",(858) 272-3100,49,http://www.worldfamouspb.com; http://www.worldfamouspb.com; ,manager@worldfamouspb.com; worldfamous@san.rr.com; ,"World Famous is a full-service restaurant that serves contemporary California cuisine. It specializes in seafood and hand-cut steak items. The restaurant s menu includes salads, soups, sandwiches and pasta dishes. It also serves omelets, tortillas and French toast. World Famous features a main room, patio and bar. The restaurant additionally serves beverages and its wine list includes chardonnay, sauvignon blanc, riesling, pinot grigio, merlot, zinfandel and shiraz. World Famous is located in San Diego.",Mon - Sun: 7:00 am - 11:00 pm; ,"visa, discover, mastercard, amex","Seafood Restaurants, American Restaurants, Bars, Breakfast, Brunch & Lunch Restaurants, Night Clubs, Restaurants, Taverns ",,"Mission Beach, Northern San Diego, Pacific Beach",,"Parking: Street, Validated, Valet;Wi-Fi: No;Bike Parking: Yes;Attire: Casual;Wheelchair Accessible: Yes;Cuisines: American, Breakfast, Brunch & Lunch, Seafood;Alcohol: Full Bar;Takes Reservations: Yes;Outdoor Seating: Yes;Price Range : Average;"
20,Mimi's Cafe,(4 Reviews),"10788 Westview Pkwy, San Diego, CA 92126",(858) 566-6667,41,http://www.mimiscafe.com; http://www.mimiscafe.com; ,,"Mimi's is a beloved neighborhood cafe known for indulgent breakfast and brunch with signature ""Mimi-mosas"" and seasonal muffins, French-American ""Le Duet"" lunch combos and dinners like ""Steak Frites"" with thin hand-cut Russet potatoes and Grilled Atlantic Salmon. House wine from France is on offer for $5 a glass and $20 a bottle. For Birthday parties, Mimi's gives a free Birthday Cake to parties of 8 or more.",Mon - Thu: 7:00 am - 9:00 pm; Fri - Sat: 7:00 am - 10:00 pm; Sun: 7:00 am - 9:00 pm; ,"master card, visa, all major credit cards, amex, cash, discover","American Restaurants, Breakfast, Brunch & Lunch Restaurants, Restaurants ",,"Mira Mesa, Northeastern San Diego",,"Parking: Lot, Private;Wi-Fi: Free;Bike Parking: Yes;Attire: Casual;Wheelchair Accessible: Yes;Cuisines: American, Breakfast, Brunch & Lunch;Alcohol: Beer, Wine;Takes Reservations: Yes;Outdoor Seating: No;Price Range : Average;"
21,Firehouse American Eatery and Lounge,(10 Reviews),"722 Grand Ave, San Diego, CA 92109",(858) 274-3100,13,http://firehousepb.com; http://firehousepb.com; ,Chelsea@firehousepb.com; ,"FIREHOUSE AMERICAN EATERY + LOUNGE is an eating establishment in the state of California. The restaurant serves a variety of snacks, appetizers, soups, salads, and wines and beverages. It offers Caesar, Mediterranean and baby spinach salads. The restaurants  snacks include steamed mussels, nachos, crab cakes, chicken strips and cheese fondues.",Mon - Wed: 10:00 am - 12:00 am; Thu - Fri: 10:00 am - 2:00 am; Sat: 9:00 am - 2:00 am; Sun: 10:00 am - 12:00 am; ,"all major credit cards, amex, discover, master card, visa","American Restaurants, Bars, Breakfast, Brunch & Lunch Restaurants, Cocktail Lounges, Family Style Restaurants, Night Clubs, Restaurants, Seafood Restaurants, Take Out Restaurants, Taverns ",,"Pacific Beach, Northern San Diego",,"Parking: Street, Lot, Valet, Private;Wi-Fi: Free;Bike Parking: Yes;Attire: Casual;Wheelchair Accessible: Yes;Cuisines: Family Style, American, Take Out, Breakfast, Brunch & Lunch, Seafood;Alcohol: Full Bar;Takes Reservations: Yes;Outdoor Seating: Yes;Price Range : Average;Pets Allowed: No;Good For Groups: Yes;"
22,The Broken Yolk Cafe,(1 Review),"1760 Camino Del Rio N, San Diego, CA 92108",(619) 574-9655,6,https://www.thebrokenyolkcafe.com/mission-valley; https://www.thebrokenyolkcafe.com/mission-valley; ,missionvalley@thebrokenyolkcafe.com; ,"When it comes to breakfast and brunch in Mission Valley, the Broken Yolk Cafe is the perfect place to start your morning. Dishing out huge portions of all the breakfast classics, as well as Mexican-style favorites like Baja Breakfast Tacos and carne asada Border Benedict, the Broken Yolk is one of the best San Diego breakfast restaurants!",Mon - Sun: 6:00 am - 3:00 pm; ,"all major credit cards, master card, visa","American Restaurants, Breakfast, Brunch & Lunch Restaurants, Restaurants ",,"Mission Valley East, Eastern San Diego",,"Parking: Lot, Private;Wi-Fi: Free;Bike Parking: Yes;Attire: Casual;Cuisines: Omelets;Alcohol: Beer, Wine;Takes Reservations: No;Outdoor Seating: Yes;Price Range : Average;"
23,Baci Restaurant,(4 Reviews),"1955 Morena Blvd, San Diego, CA 92110",(619) 275-2094,40,http://www.sandiegobaci.com/menus.php; http://www.sandiegobaci.com/menus.php; ,info@sandiegobaci.com; Tony@bacicucina.com; ,,Mon - Fri: 11:30 am - 9:30 pm; Sat: 5:30 pm - 10:00 pm; Sun Closed; ,discover,"Italian Restaurants, Banquet Halls & Reception Facilities, Continental Restaurants, Mediterranean Restaurants, Restaurants, Seafood Restaurants ",,"Bay Park, Northern San Diego",,"Parking: Street, Lot, Private;Wi-Fi: No;Bike Parking: Yes;Attire: Dressy;Wheelchair Accessible: Yes;Cuisines: Mediterranean, Italian, European, Seafood, Continental;Alcohol: Full Bar;Takes Reservations: Yes;Outdoor Seating: No;"
24,Joe's Crab Shack,(4 Reviews),"525 E Harbor Dr, San Diego, CA 92101",(619) 233-7391,28,http://www.joescrabshack.com/locations/10173; http://www.joescrabshack.com/locations/10173; https://www.joescrabshack.com/menu/food; ,socialmedia@joescs.com; ,"Joe's Crab Shack serves seafood and creative cocktails with Southern coastal flair to locations all across America. Joe's menu features fried shrimp platters, signature fish entrÃ©es, and renowned steam pots",Mon - Thu: 11:00 am - 10:00 pm; Fri - Sat: 11:00 am - 11:00 pm; Sun: 11:00 am - 10:00 pm; ,"amex, discover, master card, visa, cash, check, diners club, travelers checks","Seafood Restaurants, American Restaurants, Family Style Restaurants, Restaurants, Take Out Restaurants ",Crab|Group Parties|Seafood|Seafood Restaurant|Shrimp|,"Central San Diego, Marina",,"Parking: Lot, Private;Wi-Fi: No;Bike Parking: Yes;Attire: Casual;Good For Groups: Yes;Wheelchair Accessible: Yes;Cuisines: Family Style, Seafood;Alcohol: Beer, Full Bar, Wine;Takes Reservations: Yes;Outdoor Seating: Yes;Price Range : Average;"
25,Carvers Steak & Chops,(3 Reviews),"11940 Bernardo Plaza Dr, San Diego, CA 92128",(858) 485-1262,16,http://www.carverssteak.com; http://www.carverssteak.com; http://www.carverssteak.com/bar.htm; ,info@carverssteak.com; ,"Carvers Steaks and Chops is a privately-owned, independently-operated restaurant. It offers a range of starters, including garlic cheese bread, Cajun lamb chops, crab cakes, calamari fritti, stuffed portobello mushroom, and spinach and artichoke dip. The restaurant also provides a variety of entr e dishes that includes shrimp scampi, Alaskan crab legs, New York strip, fillet mignon, porterhouse, grilled lamb chops and Chicago-cut rib eye. Additionally, it offers a range of wines that includes merlot, syrah, zinfandel, chardonnay, sauvignon blanc and cabernet sauvignon. Carvers Steaks and Chops is owned by T & M Restaurants and also offers catering services. The restaurant is located in San Diego.",Mon - Sun: 11:30 am - 9:00 pm; ,"visa, amex, mastercard, discover","Steak Houses, American Restaurants, Barbecue Restaurants, Caterers, Restaurants ",,"Rancho Bernardo, Northeastern San Diego",,"Parking: Lot, Private;Wi-Fi: No;Bike Parking: No;Attire: Casual;Wheelchair Accessible: Yes;Cuisines: Caterers, Barbecue, American, Steakhouse;Alcohol: Full Bar;Takes Reservations: Yes;Outdoor Seating: No;Specialties: Banquets, Family Events, Restaurants, Community Functions, Family Functions;"
26,Luigi's At The Beach,(1 Review),"3210 Mission Blvd, San Diego, CA 92109",(858) 488-2818,34,http://www.luigisatthebeach.com; http://www.luigisatthebeach.com; ,GreatFood@LuigisAtTheBeach.com; ,"Luigi's At The Beach is a serves a variety of pizzas, beers and Italian-style cuisine. Established in 1985, the restaurant is family-owned and operated. It specializes in providing dine-in, takeout, delivery and catering services. Luigi's At The Beach also offers calzones, salads, burgers and hot sandwiches. The restaurant specializes in making pizza sauce and dough from scratch using a secret recipe of spices. Its entr e menu includes spaghetti, fettuccine and penne with mushroom, marinara and meat sauce. The restaurant also offers lasagnas, eggplant parmigiana and chicken picatta. In addition, it serves a variety of draft beer, cocktails and wines. Luigi's At The Beach is located in San Diego.",Mon - Thu: 11:00 am - 10:30 pm; Fri - Sat: 11:00 am - 11:00 pm; Sun: 11:00 am - 10:30 pm; ,"amex, discover, diners club","Italian Restaurants, American Restaurants, Hamburgers & Hot Dogs, Mediterranean Restaurants, Pizza, Restaurants, Sandwich Shops ",,"Mission Beach, Northern San Diego",,"Parking: Street;Wi-Fi: No;Bike Parking: Yes;Attire: Casual;Wheelchair Accessible: Yes;Cuisines: Burgers, Mediterranean, American, Sandwiches, Hot Dogs, Italian, European, Continental, Pizza;Alcohol: Beer, Wine;Takes Reservations: No;Outdoor Seating: Yes;Price Range : Average;"
27,Uno Chicago Grill,(1 Review),"4465 Mission Blvd, San Diego, CA 92109",(858) 483-4143,,http://www.unos.com; http://www.unos.com; ,,,,,"Italian Restaurants, Bar & Grills, Pizza, Restaurants, Take Out Restaurants ",,"Pacific Beach, Northern San Diego",,"Alcohol: Beer, Wine;Cuisine: Italian, Bar Food, European, Continental, Pizza;"
28,The Mission Restaurant-Mission Beach,(0 Review),"3795 Mission Blvd, San Diego, CA 92109",(858) 488-9060,22,http://www.themissionsd.com; http://www.themissionsd.com; http://www.themissionsd.com/locations.html; ,,,Mon - Sun: 7:00 am - 3:00 pm; ,discover,"American Restaurants, Breakfast, Brunch & Lunch Restaurants, Health Food Restaurants, Restaurants, Vegan Restaurants, Vegetarian Restaurants ",,"Mission Beach, Northern San Diego",,"Parking: Street;Wi-Fi: No;Bike Parking: Yes;Cuisines: American, Breakfast, Brunch & Lunch, Healthy, Vegetarian, Vegan;Price Range : Average;"
29,Chronic Smoothies Blazin Gril,(0 Review),"865 Turquoise St, San Diego, CA 92109",(858) 488-2529,19,http://www.theblazingrill.com; http://www.theblazingrill.com; ,restaurant@theblazingrill.ie; ,,Mon - Fri: 9:00 am - 9:00 pm; Sat - Sun: 9:00 am - 10:00 pm; ,,"American Restaurants, Bar & Grills, Restaurants ",,"Pacific Beach, Northern San Diego",,"Parking: Lot, Free;Wheelchair Accessible: Yes;Price Range : Below Average;"
30,Cowboy Star,(6 Reviews),"640 10th Ave, San Diego, CA 92101",(619) 450-5880,11,http://www.thecowboystar.com; http://www.thecowboystar.com; https://www.thecowboystar.com; ,info@thecowboystar.com; ,"Cowboy Star is the first restaurant in San Diego’s East Village to serve up a unique dining experience by combining contemporary American cuisine with a western flare. Winner of the 2008 Orchid Award for Interior Design, the restaurant features exposed beam ceilings‚ cowboy accents‚ and classic landscape photography giving Cowboy Star a welcoming atmosphere where locals gravitate.A stunning display kitchen is the focal point of Cowboy Star, offering an insiders view of the action. The bar at Cowboy Star offers a stylish and cozy environment complete with large leather booths, a fireplace and hand-crafted cocktails. The Old West ambiance provides a laid-back and stylish background perfect for private parties and special events.",Mon: 5:00 pm - 10:00 pm; Tue - Thu: 10:30 am - 11:00 pm; Fri - Sat: 5:00 pm - 10:30 pm; Sun: 5:00 pm - 9:00 pm; ,"discover, mastercard, visa, amex","American Restaurants, Bar & Grills, Breakfast, Brunch & Lunch Restaurants, Restaurants, Steak Houses ",,"East Village, Central San Diego",,"Good For Groups: Yes;Cuisines: American, Breakfast, Brunch & Lunch, Steakhouse, Bar & Grills;Alcohol: Yes, No;"
31,Bronx Pizza,(27 Reviews),"111 Washington St, San Diego, CA 92103",(619) 291-3341,19,http://www.bronxpizza.com; http://www.bronxpizza.com; ,MGardner@bronxpizza.com; ,,Mon - Thu: 11:00 am - 10:00 pm; Fri - Sat: 11:00 am - 11:00 pm; Sun: 11:00 am - 10:00 pm; ,"cash only, no credit cards, amex, cash, discover, master card, paypal, visa","Pizza, American Restaurants, Fast Food Restaurants, Italian Restaurants, Restaurants ",,"Hillcrest, Western San Diego",,
32,Sushi Ota,(19 Reviews),"4529 Mission Bay Dr, San Diego, CA 92109",(858) 270-5670,29,http://sushiota.com; http://sushiota.com; ,,,Mon: 5:30 pm - 10:30 pm; Tue - Fri: 11:30 am - 10:30 pm; Sat - Sun: 5:00 pm - 10:30 pm; ,discover,"Sushi Bars, Asian Restaurants, Japanese Restaurants, Restaurants, Seafood Restaurants ",,"Pacific Beach, Northern San Diego",,"Parking: Lot, Private;Wi-Fi: No;Bike Parking: No;Attire: Casual;Wheelchair Accessible: Yes;Cuisines: Japanese, Asian, Sushi, Seafood;Alcohol: Beer, Wine;Takes Reservations: Yes;Outdoor Seating: No;"
33,Hash House a Go Go,(19 Reviews),"3628 5th Ave, San Diego, CA 92103",(619) 298-4646,19,http://www.hashhouseagogo.com; http://www.hashhouseagogo.com; ,,"Hash House a go go is a full-service restaurant that provides a variety of food items and beverages for breakfast, lunch and dinner. The restaurant offers spinach, tomato, grilled salmon, Caesar and red leaf salads. It serves mushrooms, chicken breasts, goat cheese, chicken sandwiches, French toast, waffles, meat loaf and sausage for brunch. The restaurant also provides pasta dishes, crab cakes, beef, ribs and steaks. Hash House a go go has received the California Restaurant Association Best Breakfast 2007 Gold Medallion award. The restaurant offers turkey, mozzarella cheese, biscuits, pork and seasonal vegetables. Hash House has additionally received recognitions from various magazines and news channels for excellence in food services.",Mon: 7:30 am - 2:30 pm; Tue - Thu: 7:30 am - 9:00 pm; Fri - Sat: 7:30 am - 9:30 pm; Sun: 7:30 am - 9:00 pm; ,"amex, visa, discover, mastercard","Breakfast, Brunch & Lunch Restaurants, American Restaurants, Bar & Grills, Delicatessens, Family Style Restaurants, Restaurants ",,"Hillcrest, Western San Diego",,"Cuisines: Deli, Family Style, American, Breakfast, Brunch & Lunch, Bar & Grills;Price Range : Average;"
34,Pho Ca Dao Restaurant,(28 Reviews),"8373 Mira Mesa Blvd, San Diego, CA 92126",(858) 564-0917,18,http://phocadao.com; http://phocadao.com; http://phocadaogrill.com; ,phocadao@gmail.com; dukehuynh@nethere.com; ,,Mon - Thu: 8:00 am - 9:00 pm; Fri - Sat: 8:00 am - 9:30 pm; Sun: 8:00 am - 9:00 pm; ,all major credit cards,"Vietnamese Restaurants, Asian Restaurants, Family Style Restaurants, Restaurants ",,"Mira Mesa, Northeastern San Diego",,"Parking: Lot, Private;Wi-Fi: No;Bike Parking: Yes;Attire: Casual;Wheelchair Accessible: Yes;Cuisines: Vietnamese, Asian, Family Style;Alcohol: Beer, Wine;Takes Reservations: Yes;Outdoor Seating: No;Price Range : Below Average;Pets Allowed: No;"
35,Urban Solace,(13 Reviews),"3823 30th St, San Diego, CA 92104",(619) 295-6464,13,http://www.urbansolace.net; http://www.urbansolace.net; ,comfortfood@urbansolace.net; ,,Mon - Thu: 11:00 am - 10:00 pm; Fri: 11:00 am - 11:00 pm; Sat: 10:30 am - 11:00 pm; Sun: 9:30 am - 9:00 pm; ,"amex, discover, master card, visa, all major credit cards","Delicatessens, Caterers, Family Style Restaurants, Restaurants ",,"North Park, Western San Diego",,"Parking: Garage, Street;Wi-Fi: Free;Bike Parking: Yes;Attire: Casual;Good For Family: Yes;Good For Groups: Yes;Wheelchair Accessible: Yes;Cuisines: Deli, Caterers, Family Style;Alcohol: Full Bar, Wine;Takes Reservations: Yes;Outdoor Seating: Yes;Price Range : Average;Pets Allowed: No;Good for Kids: Yes;"
36,Mediterranean Cafe,(30 Reviews),"112 W Washington St, San Diego, CA 92103",(619) 298-7738,24,http://www.medi-cafe.com; http://www.medi-cafe.com; ,,,Mon - Sun: 11:00 am - 9:00 pm; ,"visa, master card, amex, cash, debit","Greek Restaurants, Caterers, Mediterranean Restaurants, Restaurants, Vegetarian Restaurants ",,"Western San Diego, Hillcrest",,"Parking: Street;Wi-Fi: Free;Bike Parking: Yes;Attire: Casual;Wheelchair Accessible: Yes;Cuisines: Mediterranean, Caterers, Greek, European, Healthy, Vegetarian, Continental;Alcohol: Beer, Wine;Takes Reservations: Yes;Outdoor Seating: No;"
37,The Oceanaire Seafood Room,(21 Reviews),"400 J St, San Diego, CA 92101",(619) 858-2277,,http://www.theoceanaire.com/Locations/SanDiego/Locations.aspx; http://www.theoceanaire.com/Locations/SanDiego/Locations.aspx; http://www.theoceanaire.com; ,oain@ldry.com; ,The Oceanaire provides the perfect setting to enjoy the freshest seafood flown in daily from around the world. Our knowledgeable staff will delight you with exceptional service — guiding you through the wide variety of items on our menu and helping you select the perfect wine to complement your meal. You'll find out why The Oceanaire has been voted one of the best seafood restaurants in the country.,Mon - Thu: 11:30 am - 10:00 pm; Fri: 11:30 am - 11:00 pm; Sat: 5:00 am - 11:00 pm; Sun: 5:00 am - 9:00 pm; ,"cash, amex, discover, master card, visa, check, diners club, travelers checks","Seafood Restaurants, American Restaurants, Fine Dining Restaurants, Fish & Seafood Markets, Restaurants, Steak Houses ",,"Gaslamp, Central San Diego",,"Parking: Street, Valet;Wi-Fi: Free;Bike Parking: Yes;Attire: Dressy;Wheelchair Accessible: Yes;Cuisines: Seafood;Alcohol: Full Bar;Takes Reservations: Yes;Outdoor Seating: No;"
38,Filippi's Pizza Grotto,(18 Reviews),"1747 India St, San Diego, CA 92101",(619) 232-5094,69,http://www.realcheesepizza.com; http://www.realcheesepizza.com; http://www.realcheesepizza.com/web/menus/index.html; ,,"Filippi's Pizza Grotto has served traditional family recipes in the area for more than 50 years. Throughout our years of service, we use only the finest and freshest ingredients to capture the authentic Italian flavor that customers crave for in Italian dishes. Enjoy a sumptuous and satisfying Italian meal at our fine restaurant today. Enjoy a delicious dining experience at an authentic Italian restaurant today! Filippi's Pizza Grotto is a family-owned and operated Italian restaurant offering a variety of Italian food to customers in San Diego and the surrounding areas. Our menu consists of scrumptious dishes that customers will surely love.",Mon: 11:00 am - 10:00 pm; Tue - Thu: 11:00 am - 10:30 pm; Fri - Sat: 11:00 am - 11:30 pm; Sun: 11:00 am - 10:00 pm; ,"discover, master card, all major credit cards, debit","Pizza, Italian Restaurants, Pasta, Restaurants ","We serve soups, salads, sandwiches, pastas, pizza, desserts and much more.","Little Italy, Central San Diego",,"Parking: Street;Wi-Fi: No;Bike Parking: Yes;Attire: Casual;Good For Family: Yes;Good For Groups: Yes;Wheelchair Accessible: Yes;Cuisines: Italian, European, Continental, Pizza;Alcohol: Beer, Wine;Takes Reservations: No;Outdoor Seating: No;Price Range : Average;Good for Kids: Yes;"
39,Mister A's,(11 Reviews),"2550 5th Ave, San Diego, CA 92103",(619) 239-1377,26,http://www.asrestaurant.com; http://www.asrestaurant.com; https://www.asrestaurant.com; ,comments@asrestaurant.com; info@Asrestaurant.com; ,"Mister A's is the penthouse, fine-dining destination of San Diego, and has been for over 50 years. Located just a few minutes from downtown, you will take the elevator to the top floor and look back out over jetliners sweeping past at eye level, the San Diego skyline, bay and Pacific, while enjoying Modern American cuisine, hand-crafted cocktails, and one of Wine Spectator's top-rated wine lists in the country. The culinary staff hand-selects local farm produce and the highest quality ingredients in every category to offer you selections that are made from scratch in house for brunch, lunch, dinner.. or simply the finest rooftop drinks and appetizers in town.",Mon - Thu: 5:30 pm - 9:45 pm; Fri: 11:30 am - 2:15 pm; Sat: 5:00 pm - 9:45 pm; Sun: 10:00 am - 2:00 pm; ,"amex, visa, all major credit cards, debit, diners club, discover, master card","American Restaurants, Bar & Grills, Breakfast, Brunch & Lunch Restaurants, Caterers, Fine Dining Restaurants, French Restaurants, Restaurants ",$$$$,"Park West, Central San Diego",,"Parking: Street, Valet;Wi-Fi: No;Bike Parking: No;Attire: Dressy;Wheelchair Accessible: Yes;Cuisines: Fine Dining, Caterers, American, French, Breakfast, Brunch & Lunch, European, Continental, Bar & Grills;Alcohol: Full Bar;Takes Reservations: Yes;Outdoor Seating: Yes;"
40,Point Loma Seafoods,(9 Reviews),"2805 Emerson St, San Diego, CA 92106",(619) 223-1109,31,http://www.pointlomaseafoods.com; http://www.pointlomaseafoods.com; http://pointlomaseafoods.net; ,,"Established in 1963, Point Loma Seafoods is a restaurant which primarily serves and sells fish products. Its menu includes seafood plates, sandwiches, chowders and salads. The restaurant provides special kids meals that include fish and chicken with fries. It serves seafood cocktails, including smoked fish, Gulf shrimp, oyster cocktail, oysters on the half shell, calms on the half shell, picked squid and ceviche. It also offers a variety of juices, sodas, milk, coffee and tea. It serves various dishes of sushi and sashimi. The restaurant also sells live lobsters and crabs from its indoor salt water tanks. Point Loma Seafoods is located in San Diego. The restaurant provides a venue for parties and offers custom-made services.",Mon - Sat: 9:00 am - 7:00 pm; Sun: 10:00 am - 7:00 pm; ,all major credit cards,"Seafood Restaurants, American Restaurants, Asian Restaurants, Fish & Seafood Markets, Fish & Seafood-Wholesale, Japanese Restaurants, Restaurants, Sushi Bars ",Gourmet Foods|,"Roseville - Fleet Ridge, Western San Diego",,"Parking: Free;Wi-Fi: No;Bike Parking: Yes;Attire: Casual;Wheelchair Accessible: Yes;Cuisines: Japanese, Asian, American, Sushi, Seafood;Alcohol: Beer, Wine;Takes Reservations: No;Outdoor Seating: Yes;Price Range : Average;Pets Allowed: Yes;"
41,Pappalecco,(2 Reviews),"1602 State St, San Diego, CA 92101",(619) 238-4590,12,http://www.pappalecco.com; http://www.pappalecco.com; https://www.pappalecco.com; ,gelato@pappalecco.com; ,,Mon - Thu: 7:00 am - 10:30 pm; Fri: 7:00 am - 11:30 pm; Sat: 7:30 am - 11:30 pm; Sun: 7:30 am - 10:30 pm; ,"mastercard, discover, visa, amex","Italian Restaurants, Coffee & Espresso Restaurants, Dessert Restaurants, Ice Cream & Frozen Desserts, Mediterranean Restaurants, Pizza, Restaurants, Sandwich Shops ",,"Little Italy, Central San Diego",,Parking: Street;Wi-Fi: Free;Bike Parking: Yes;Attire: Casual;Wheelchair Accessible: Yes;Takes Reservations: No;Outdoor Seating: Yes;Price Range : Below Average;
42,Werewolf,(0 Review),"627 4th Ave, San Diego, CA 92101",(619) 234-0094,,http://www.thewerewolf.net; http://www.thewerewolf.net; http://instagram.com/werewolfsd; ,craigmaslan@hotmail.com; ,,Mon - Sun: 8:00 am - 2:00 pm; ,"mastercard, discover, amex, visa","American Restaurants, Bars, Brew Pubs, Night Clubs, Restaurants, Taverns ",,"Gaslamp, Central San Diego",,Parking: Street;Wi-Fi: Free;Bike Parking: Yes;Attire: Casual;Alcohol: Full Bar;Takes Reservations: Yes;Outdoor Seating: Yes;Price Range : Average;Pets Allowed: Yes;
