ID,Restaurant Name,Review,Address,Phone Number,Years in Business, Website Link,Email Address,General Information,Time(in Hour),Payment Methods,Category,Services/Products,Neighborhood,Banner Link,Other Information
1,Blue Wave Bar & Grill,(1 Review),"2051 Shelter Island Dr, San Diego, CA 92106",(619) 376-1639,30,http://www.islandpalms.com/dining.aspx; http://www.islandpalms.com/dining.aspx; http://www.islandpalms.com; ,ipreservations@islandpalms.com; astewart@islandpalms.com; ,"Enjoy the beautiful view of Point Loma paired with the delectable flavors of seasonally inspired cuisine created by Executive Chef, Christopher Spayde. What's more, the restaurant features an excellent wine list and the lounge offers a daily happy hour. You can also order room service or have food delivered poolside. Relax and unwind around a great meal at Blue Wave Bar & Grill.",Mon - Sun: 6:30 am - 10:00 pm; ,"amex, discover, mastercard, visa","Restaurants, Bar & Grills, Bars, Breakfast, Brunch & Lunch Restaurants, Cocktail Lounges, Hotels, Lodging, Night Clubs, Seafood Restaurants, Taverns ",Cocktail Lounges|Restaurants|,"La Playa, Western San Diego",https://i1.ypcdn.com/displaygif/sbc/BlueWaveBarGri_1571479_BW.gif,"Parking: Lot, Private;Wi-Fi: Free;Bike Parking: Yes;Attire: Casual;Wheelchair Accessible: Yes;Cuisines: Omelets;Alcohol: Full Bar;Takes Reservations: Yes;Outdoor Seating: Yes;Specialties: Banquets, Meetings;Price Range : Average;"
2,Sorrento Ristorante & Pizzeria,(0 Review),"1646 India St, San Diego, CA 92101",(619) 317-1779,,https://api.superpages.com/xml/search?SRC=ypintfeed&subaffiliate=DXC&PGID=e02.7182.8182845904523&SPGID=1559895188831.11bf6219&ADID=11897193&DEST=http%3A%2F%2Fsorrentoristoranteandpizzeria2.mydex.com%2F9S2mfe57-nY&C=Italian%20Restaurants&T=San%20Diego&S=CA&PH=(619)%20317-1779&FL=url&TL=off&position=0&PS=1&PI=1&Results=FEED_CLCK&uid=11bf6219-4521-4591-aab9-5853be0986c8&REF=&IP=103.250.188.75&UserAgent=python-requests%2F2.22.0; https://api.superpages.com/xml/search?SRC=ypintfeed&subaffiliate=DXC&PGID=e02.7182.8182845904523&SPGID=1559895188849.11bf6219&ADID=11897193&DEST=http%3A%2F%2Fsorrentoristoranteandpizzeria2.mydex.com%2F9S2mfe57-nY&C=Italian%20Restaurants&T=San%20Diego&S=CA&PH=(619)%20317-1779&FL=url&TL=off&position=0&PS=1&PI=1&Results=FEED_CLCK&uid=11bf6219-4521-4591-aab9-5853be0986c8&REF=&IP=103.250.188.75&UserAgent=python-requests%2F2.22.0; https://www.sorrentoristoranteandpizzeria.com; ,sorrento_littleitaly@hotmail.com; ,"Established in 2015, Sorrento ristorante is reviving the culture and gastronomie of Sorrento in Italy. Some of the most popular dishes include : fresh cut octopus carpaccio, sauteed clams and mussels in a garlicky cherry tomato sauce, cannelloni au gratin with smoked mozzarella, homemade buttery provolone raviolis, traditional veal picatta in a lemon caper sauce, authentic italian style pizza or even the delicate and zesty tiramisu al limoncello. At Sorrento ristorante, we specialize in authentic regional Italian cuisine. Some of our most popular dishes include : carpaccio di polipo, gamberi portofino, pizze profumata, lnguine nere, orechiette e cime di rapa, tiramisu al limoncello, and many more choices!",Mon - Sun: 11:30 am - 11:00 pm; ,all major credit cards,"Italian Restaurants, Bars, Caterers, Pizza, Restaurants, Taverns ",Beer|Thin Crust Pizza|Sicilian Pizza|Appetizers|Healthy & Vegetarian Menus|Vegetarian Pizza|Alcoholic Beverages|Salad Bars|Breadsticks|Wine|Spaghetti|Custom Menus|Gluten Free Pizza Restaurants|Gourmet Pizza|Stuffed Pizza|Organic Wholewheat Pizza|Gourmet Foods|Pan Pizza||Pizza Buffet|Late Night Dining|Private Dining|Gift Certificates|Formal Dining|Pizza Takeout|Early Bird Dinners|Outdoor Dining|Happy Hour|Take Out|Birthday Parties|Bar|Late Night Dining|Group Dining|Happy Hour,"Little Italy, Central San Diego",,Attire: Casual;Wi-Fi: No;Pets Allowed: Yes;Wheelchair Accessible: Yes;Takes Reservations: Yes;Parking: Street;Bike Parking: No;Outdoor Seating: Yes;
3,El Indio Mexican Restaurant and Catering,(5 Reviews),"3695 India St, San Diego, CA 92103",(619) 798-5428,79,http://www.elindiosandiego.net; http://www.elindiosandiego.net; http://www.el-indio.com; http://www.elindiocatering.com; ,jennifer@el-indio.com; itdept@elindiocatering.com; martha@elindiocatering.com; ,Come Celebrate our 75th Year Serving San Diego!,Mon - Sun: 8:00 am - 9:00 pm; ,"visa, amex, mastercard, paypal, all major credit cards","Restaurants, Caterers, Family Style Restaurants, Food & Beverage Consultants, Gourmet Shops, Grocers-Ethnic Foods, Grocery Stores, Mexican & Latin American Grocery Stores, Mexican Restaurants, Party Favors, Supplies & Services, Take Out Restaurants, Tortillas ",Anniversaries|Appetizers|Birthdays|Breakfast|Burritos|Carnitas|Catering|Catering Services|Chimichangas|Corporate Events|Dessert|Dinner|Enchiladas|Free Parking|Graduations|Lunch|Nachos|Picnics|Quesadillas|Rentals|Restaurants|Tacos|Tamales|Tortillas|Weddings|,"Midtown, Western San Diego",https://i1.ypcdn.com/displaygif/sbc/ElIndioMexican_1007206_BW.gif,"Parking: Street, Lot, Private;Wi-Fi: Free;Attire: Casual;Wheelchair Accessible: Yes;Take Out: Yes;Takes Reservations: No;Outdoor Seating: Yes;Price Range : Below Average;Specialties: Bridal, Business Events, Fiestas;"
4,Sportsmen's Seafood,(2 Reviews),"1617 Quivira Rd, San Diego, CA 92109",(619) 224-3551,65,http://www.sportsmensseafood.com; http://www.sportsmensseafood.com; ,joe@sportsmensseafood.com; ,"Sportsmen’s Seafoods was founded in 1965 by Grandfather Busalacchi and offers casual dining with a waterfront view. Next door is the Fish Market where we offer the freshest fish, shellfish, smoked fish and even jerky. In addition we offer our exclusive one-stop complete processing services directly to you.   Serving the Sports Fisherman in San Diego Since 1965 We offer our exclusive one-stop complete processing services directly to you! In the very same tradition that founded America’s commercial fishing industry, the World Famous Tuna Jerky Co. located at Sportsmen’s Seafood now offers the same Old World quality and dedicated service that Captains and Crews have enjoyed exclusively for years. Our family guarded marinade recipies and smoking technique are the “SECRET” ingredients you can’t find anywhere but at World Famous Tuna Jerky. Delicious Smoking and processing of your catch – “Taste the Difference” DON’T BE MISLEAD BY LOW QUALITY COMPETITORS • They can try to copy our name, but they can’t copy our quality or service • We use only YOUR fish, NO “trading out” or “switching” for other lesser-quality product • We work with you from start to finish – We aren’t done until you are satisfied • Our name & reputation are here to stay – We won’t change it every year to fool you • Our Quality, Customer Service and Satisfaction are Guaranteed • We are the longest operating seafood processor serving Fisherman’s Landing, Point Loma Sportfishing and H & M Landing.  • We offer convenient Direct Dockside Pick-Up  The same spirit that founded America brought Grandfather Busalacchi from Italy to the promise of “Free Enterprise” and the American way of life. Now two generations later, Sportsmen’s Seafood carries that same tradition Grandfather Busalacchi brought with him… offering only the best and freshest seafood San Diego has to offer! Most offerings on our menu are homemade family recipes and we only use the finest ingredients including cholesterol free oil. The best seafood in San Diego wouldn’t be complete without a waterfront location that gives you one of the most scenic views on the west coast. Welcome to Sportsmen’s Seafood and enjoy!",Tue - Sun: 11:00 am - 8:00 pm; ,"visa, mastercard, discover, cash","Restaurants, Box Lunches, Caterers, Fish & Seafood Markets, Seafood Restaurants, Take Out Restaurants ",Casual Dining Fish Market Fish Processing Smoked Fish Fish Jerkies,"Mission Bay Park, Northern San Diego",https://i1.ypcdn.com/displaygif/sbc/89fc5689335342108d40de5172760ff1.gif,"Parking: Lot, Private;Wi-Fi: No;Bike Parking: Yes;Attire: Casual;Wheelchair Accessible: Yes;Cuisines: Seafood;Takes Reservations: No;Outdoor Seating: Yes;Price Range : Below Average;"
5,Humphreys Restaurant,(2 Reviews),"2303 Shelter Island Dr, San Diego, CA 92106",(619) 354-7246,32,http://www.humphreysrestaurant.com; http://www.humphreysrestaurant.com; http://www.humphreysbythebay.com; http://www.humphreysbackstagelive.com; ,manager@humphreysrestaurant.com; ,"Long regarded in San Diego and abroad as one of the city's finest waterfront restaurants, Humphreys Restaurant features Modern Global Cuisine at its finest and overlooks the marina on beautiful San Diego Bay. After dinner, dance the night away in our adjacent Backstage Music Club to the finest live entertainment San Diego has to offer. Reservations made online are for the dining room only. Sunday Brunch: $43.95 for Adults and free for Children 4-12. If you want to enjoy the live jazz during your brunch, the reservation can not be made online.",Mon - Thu: 6:30 am - 9:00 pm; Fri: 6:30 am - 10:00 pm; Sat: 7:00 am - 10:00 pm; Sun: 7:00 am - 9:00 pm; ,"amex, visa, discover, cash, master card, all major credit cards","Restaurants, Convention Services & Facilities, Family Style Restaurants ",Restaurants,"La Playa, Western San Diego",,Cuisines: Family Style;Price Range : Below Average;
6,DeLuca's Pizza Restaurant,(2 Reviews),"3226 Thorn St, San Diego, CA 92104",(619) 280-0448,35,http://www.delucasp.com; http://www.delucasp.com; ,,"Come Delucas Pizza. We have been serving delicious Pizza and Italian food since 1984. Now Serving beer and wine. De Luca's is the perfect lunch or dinner destination for any occasion. Pizza, Pasta, Sandwiches, Salads, and More. 
  Open Sun-Thu 11am-9pm (10pm Fri-Sat)",Mon - Sun: 11:00 am - 10:00 pm; ,"visa, mastercard","Restaurants, Italian Restaurants, Pizza, Restaurant Delivery Service, Take Out Restaurants ","Pasta, Pizza, Sandwiches, Salads","North Park, Western San Diego",https://i1.ypcdn.com/displaygif/sbc/d4dd662e1c1f40b8b03266ff93f69af4.gif,"Cuisines: Italian, European, Continental, Pizza;"
7,Tropical Star Restaurant & Specialty Market,(0 Review),"6163 Balboa Ave, San Diego, CA 92111",(858) 522-9772,22,http://www.tropicalstarrestaurant.com/; http://www.tropicalstarrestaurant.com; ,amandabeniquez@hotmail.com; ,"Our menu brings you authentic recipes from Puerto Rico, Cuba, Central and South America.",Mon - Sat: 11:00 am - 9:00 pm; Sun Closed; ,discover,"Restaurants, Brazilian Restaurants, Caribbean Restaurants, Caterers, Cuban Restaurants, Delicatessens, Family Style Restaurants, Grocers-Ethnic Foods, Grocery Stores, Latin American Restaurants, Mexican & Latin American Grocery Stores ",Restaurants,"Clairemont Mesa East, Northern San Diego",https://i1.ypcdn.com/displaygif/sbc/7b75ec933de44953a707a06f3852885f.gif,"Cuisines: South American, Brazilian, Caribbean, Latin American;Price Range : Below Average;"
8,Arrivederci Ristorante,(8 Reviews),"3845 4th Ave, San Diego, CA 92103",(619) 299-6282,29,http://www.arrivederciristorante.com; http://www.arrivederciristorante.com; ,toninosandiego@hotmail.com; ,"Located in the heart of Hillcrest and voted best Italian restaurant in San Diego many years in a row, Arrivederci saw its first day in 1995 thanks to the Mastellone Family. His philosophy : deliver simple food at a reasonable price with friendly service. Later the group of restaurants will grow with Au Revoir Bistro, Il Postino, Buon Appetito, Piacere Mio, Sorrento,...) Authentic Italian restaurant, Arrivederci, has a casual ambiance, traditional Italian cuisine and an atmosphere that transports you directly to Tuscany, and the middle of Campania! 
 
Our Italian homemade cuisine is a perfectly inexpensive recipe, a little bit of tradition, an ounce of modern Italian cooking inspired by different regions, and a big cup of love from our Chef and his team.",Mon - Thu: 11:30 am - 10:00 pm; Fri - Sat: 11:30 am - 11:00 pm; Sun: 11:30 am - 10:00 pm; ,"all major credit cards, debit, amex, discover, master card, visa","Restaurants, Grocers-Ethnic Foods, Grocery Stores, Italian Grocery Stores, Italian Restaurants ",Beer|Feta|Olive Oil|Traditional Colonma|Peppers|Appetizers|Ciabatta|Eggplant|Torrone|Sandwiches|Healthy & Vegetarian Menus|Homemade Pasta|Marscapone|Torta Cappucino|Alcoholic Beverages|Imported Cheeses|Salad Bars|Biscotti|Breadsticks|Wine|Spaghetti|Ricotta Salata|Homemade Breads|Pastries|Asiago|Tuna|Panetone|Pizelle|Cantucci|Drinks|Ghiottini|Provolone|Homemade Soups|Italian Cuisine||Italian Foods|Private Dining|Reservations|Family Friendly|Parking|Early Bird Dinners|Take Out|Italian Specialty Foods|Dine In|Italian Restaurant,"Hillcrest, Western San Diego",,"Parking: Street;Wi-Fi: No;Bike Parking: Yes;Attire: Casual;Good For Groups: Yes;Wheelchair Accessible: Yes;Cuisines: Italian, European, Continental;Alcohol: Beer, Yes, Wine;Takes Reservations: Yes;Outdoor Seating: Yes;Price Range : Average;"
9,Larson Sharpening Inc.,(2 Reviews),"2008 Goshawk St, San Diego, CA 92123",(858) 518-1457,65,http://supermansharp.com; http://supermansharp.com; ,neil.larson55@gmail.com; ,"Welcome to Larson Sharpening, Inc.! 
 
Larson Sharpening, Inc. is the go-to for all sharpening and repair services for beauty professionals and barbers, pet grooming and veterinarians, and the medical industry. 
 
With over 40 years of experience, Larson Sharpening, Inc. has the knowledge and aptitude to continue providing customers with exceptional service. 
 
Larson Sharpening, Inc. is family owned and operated, and we pride ourselves on providing our clients with reliable, dependable, and quality service. We also offer mobile on-site services, mail order, and pick up and drop off. Call or text us today for your quote.",Mon - Fri: 8:00 am - 6:00 pm; Sat - Sun Closed; ,"discover, master card, visa, amex","Sharpening Service, Livestock Equipment & Supplies, Mediterranean Restaurants, Restaurants, Seafood Restaurants, Sewing Machines-Service & Repair ","We sharpen clipper blades for Oster, Andis, Laube, Wahl, and other name brand clippers. We specialize in Clipper Blade Sharpening * Scissor Sharpening * Clipper Repair *","Birdland, Eastern San Diego",,
10,Sitar Indian Cuisine,(2 Reviews),"9450 Scranton Rd, San Diego, CA 92121",(858) 535-1941,22,http://sitarsandiego.com; http://sitarsandiego.com; http://sitarsandiegoca.us; http://www.tripadvisor.com/Restaurant_Review-g60750-d950445-Reviews-m32908-Sitar_Indian_Cuisine-San_Diego_California.html; ,,"The Sitar Indian Cuisine where you can find great Indian Food Vegetarian and Non-Vegetarian. ""Our Curry specialties offer you a comprehensive selection of both vegetarian and non vegetarian dishes. Carefully blended spices compliment the interesting mixture of vegetables, meats and dals (lentils), enhancing the flavor and adding subtlety to the dishes. "" The robust menu features items that are gluten-free, low-fat, vegan, vegetarian and Meat Dishes. Plus, it's been tabbed as a nice option for both families with children and large groups. Along with its outdoor seating arrangements, it's one of the few dog-friendly restaurants in the area. In addition to its quick service (take-out is available), the restaurant also offers delivery, and can even cater an event for you.",Mon - Sat: 11:00 am - 9:00 pm; Sun Closed; ,amex,"Indian Restaurants, Asian Restaurants, Caterers, Middle Eastern Restaurants, Restaurants ",,"Sorrento Valley, Northern San Diego",,"Parking: Lot, Private;Wi-Fi: No;Bike Parking: Yes;Attire: Casual;Wheelchair Accessible: Yes;Cuisines: Asian, Caterers, Indian, Middle Eastern;Alcohol: No;Takes Reservations: No;Outdoor Seating: Yes;Specialties: Banquets;Price Range : Below Average;"
11,La  Pizzeria Arrivederci,(1 Review),"3789 4th Ave, San Diego, CA 92103",(619) 430-4471,24,https://api.superpages.com/xml/search?SRC=ypintfeed&subaffiliate=DXC&PGID=e02.7182.8182845904523&SPGID=1559895210806.983db5bf&ADID=11895205&DEST=http%3A%2F%2Farrivederciristorante1.mydex.com%2Fe_eM8z1jqEY&C=Pizza&T=San%20Diego&S=CA&PH=(619)%20430-4471&FL=url&TL=off&position=0&PS=1&PI=1&Results=FEED_CLCK&uid=983db5bf-22ae-40e4-987b-bd9e41afb501&REF=&IP=103.250.188.75&UserAgent=python-requests%2F2.22.0; https://api.superpages.com/xml/search?SRC=ypintfeed&subaffiliate=DXC&PGID=e02.7182.8182845904523&SPGID=1559895210826.983db5bf&ADID=11895205&DEST=http%3A%2F%2Farrivederciristorante1.mydex.com%2Fe_eM8z1jqEY&C=Pizza&T=San%20Diego&S=CA&PH=(619)%20430-4471&FL=url&TL=off&position=0&PS=1&PI=1&Results=FEED_CLCK&uid=983db5bf-22ae-40e4-987b-bd9e41afb501&REF=&IP=103.250.188.75&UserAgent=python-requests%2F2.22.0; http://www.arrivederciristorante.com; ,arrivedercipizzeriahillcrest@gmail.com; ,"San Diegos best authentic Italian restaurant located in Hillcrest, Rancho San Diego. Homemade Italian cuisine with daily specials. Nuova cucina Italiana.",Mon - Thu: 5:00 pm - 10:00 pm; Fri - Sat: 11:30 am - 11:00 pm; Sun: 11:30 am - 10:00 pm; ,"amex, cash, discover, master card, visa","Pizza, Italian Grocery Stores, Italian Restaurants, Restaurants ",Supreme Pizza|Thin Crust Pizza|Olive Oil|Sicilian Pizza|Pizza|Soft Drinks|Vegetarian Pizza|Wood Fired Pizza|Hand Tossed Pizza|Gluten Free Pizza|Red Pizza|Appetizers|Breadsticks|Margherita Pizza|Gourmet Pizza|Stuffed Pizza|Alcoholic Beverages|Pan Pizza|Salads|Drinks|Italian Pizza||Italian Cuisine|Italian Foods|Pizza Takeout|Casual Dining|Family Friendly|Dine In|Full Bar|Parking|Take Out|Phone Orders|Italian Restaurant|Pizza Restaurant,"Hillcrest, Western San Diego",,"Parking: Street;Wi-Fi: No;Bike Parking: Yes;Attire: Casual;Wheelchair Accessible: Yes;Cuisines: Italian, European, Continental, Pizza;Alcohol: Beer, Wine;Takes Reservations: Yes;Outdoor Seating: Yes;Price Range : Average;"
12,Solunto Ristorante & Bakery,(0 Review),"1643 India St, San Diego, CA 92101",(619) 220-2358,,https://api.superpages.com/xml/search?SRC=ypintfeed&subaffiliate=DXC&PGID=e02.7182.8182845904523&SPGID=1559895213281.0f9fa43a&ADID=11914313&DEST=http%3A%2F%2Fsoluntoristoranteandbakery1.mydex.com%2FjZl6dVVI8Gg&C=Bakeries&T=San%20Diego&S=CA&PH=(619)%20220-2358&FL=url&TL=off&position=0&PS=1&PI=1&Results=FEED_CLCK&uid=0f9fa43a-2d22-4956-838c-dc7cdef62ce5&REF=&IP=103.250.188.75&UserAgent=python-requests%2F2.22.0; https://api.superpages.com/xml/search?SRC=ypintfeed&subaffiliate=DXC&PGID=e02.7182.8182845904523&SPGID=1559895213306.0f9fa43a&ADID=11914313&DEST=http%3A%2F%2Fsoluntoristoranteandbakery1.mydex.com%2FjZl6dVVI8Gg&C=Bakeries&T=San%20Diego&S=CA&PH=(619)%20220-2358&FL=url&TL=off&position=0&PS=1&PI=1&Results=FEED_CLCK&uid=0f9fa43a-2d22-4956-838c-dc7cdef62ce5&REF=&IP=103.250.188.75&UserAgent=python-requests%2F2.22.0; https://www.arrivederciristorante.com; ,solunto_littleitaly@hotmail.com; ,"Italian Cuisine & Pizzeria, appetizers, saladsItalian Cuisine & Pizzeria, appetizers, saladsItalian Cuisine & Pizzeria, appetizers, salads",Mon - Sat: 9:00 am - 10:00 pm; Sun: 9:00 am - 11:00 pm; ,"amex, cash, debit, discover, master card, visa","Bakeries, Italian Restaurants, Pizza, Pizza-Wholesale & Manufacturers, Restaurants ",Beer|Hand Tossed Pizza|Tuscan Cuisine|Appetizers|Vegetarian Foods|Healthy & Vegetarian Menus|Calzones|Salad Bars|Supreme Pizza|Salads|Baked Goods & Desserts|Alcoholic Beverages|Salad Bars|Breadsticks|Wine|Homemade Pizza|Spaghetti|Sicilian Pizza|Pasta|Custom Menus|Double Crust Pizza|Gourmet Foods|Stromboli|Appetizers|Sandwiches||Bar|Private Dining|Reservations|Family Friendly|Parking|Take Out|Phone Orders|Dine In,"Little Italy, Central San Diego",,"Cuisines: Italian, European, Continental;Cuisine: Italian, European, Ice Cream, Continental, Pizza;Price Range : Average;"
13,Anthony's Fish Grotto,(8 Reviews),"1360 N Harbor Dr, San Diego, CA 92101",(619) 232-5103,73,http://www.gofishanthonys.com; http://www.gofishanthonys.com; http://www.starofthesea.com; ,,"Our delicious food, casual atmosphere and friendly home-style service will quickly make Anthonys Fish Grotto your favorite San Diego seafood restaurant.",Mon - Thu: 11:00 am - 9:30 pm; Fri - Sat: 11:00 am - 10:00 pm; Sun: 11:00 am - 9:30 pm; ,"amex, visa, discover, cash, diners club, master card","Take Out Restaurants, American Restaurants, Banquet Halls & Reception Facilities, Bar & Grills, Family Style Restaurants, Party Planning, Restaurants, Seafood Restaurants, Wedding Reception Locations & Services, Wedding Supplies & Services ",,"Central San Diego, Marina",,"Cuisines: American, Family Style, Take Out, Seafood, Bar & Grills;"
14,Soleil @K,(8 Reviews),"660 K St, San Diego, CA 92101",(619) 696-0234,13,http://www.sandiegogaslamphotel.com/dining/soleil; http://www.sandiegogaslamphotel.com/dining/soleil; http://www.soleilatk.com; https://www.sandiegogaslamphotel.com/m/dining; ,,"Breakfast 6:30am - 11:00am (Daily), Lunch 12;00pm - 1:30pm (Daily), Dinner 5:30pm - 9:00pm (Sunday through Thursday), Dinner 5:30pm - 10:00pm (Friday and Saturday)",Mon - Sun: 7:00 am - 9:00 pm; ,discover,"American Restaurants, Bar & Grills, Bars, Breakfast, Brunch & Lunch Restaurants, Cocktail Lounges, Fine Dining Restaurants, French Restaurants, Restaurants, Take Out Restaurants, Tapas ","Fresh and Local Products, California Cuisine, Casually Elegant, Award Winning, Plush Leather Booths, Patio Seating, Rotating Seasonal Specials","East Village, Central San Diego",,"Parking: Garage, Street, Validated, Valet;Wi-Fi: Free;Bike Parking: Yes;Attire: Casual;Good For Groups: Yes;Wheelchair Accessible: Yes;Cuisines: Fine Dining, American, French, Take Out, Breakfast, Brunch & Lunch, European, Tapas, Continental, Bar & Grills;Alcohol: Yes, Full Bar, Wine;Takes Reservations: Yes;Outdoor Seating: Yes;Price Range : Average;"
15,On The Border Mexican Grill & Cantina,(3 Reviews),"1770 Camino De La Reina, San Diego, CA 92108",(619) 209-3700,37,http://www.ontheborder.com; http://www.ontheborder.com; ,AlmquistB@brinker.com; ,,Mon - Thu: 11:00 am - 11:00 pm; Fri: 11:00 am - 12:00 am; Sat: 10:00 am - 12:00 am; Sun: 10:00 am - 11:00 pm; ,"amex, discover, visa, mastercard, diners club, all major credit cards","Mexican Restaurants, Bar & Grills, Bars, Family Style Restaurants, Restaurants, Take Out Restaurants ",Beer|Border Smart|Brunch|Burritos|Carne Asada|Catering|Chile Rellenos|Chimichangas|Delivery|Dine-in|Empanadas|Enchilada Mondays|Enchiladas|Fajita & Rita Wednesdays|Fajitas|Flan|Flautas|Guacamole|Happy Hour|Late Night|Margaritas|Meltdowns|Nachos|Quesadillas|Queso|Salads|Sopapillas|Soup|Taco Fix Tuesday|Tacos|Tamales|To Go|Tortas|Tostadas|Wine|,"Mission Valley East, Eastern San Diego",,"Parking: Street, Lot, Private;Wi-Fi: No;Bike Parking: Yes;Attire: Casual;Wheelchair Accessible: Yes;Cuisines: Mexican, Latin American;Alcohol: Beer, Full Bar, Wine;Takes Reservations: Yes;Outdoor Seating: Yes;Specialties: Tacos, Queso, Free Chips & Salsa, Friendly Service, Meltdowns, Margaritas, Sizzling Fajitas;Price Range : Below Average;"
16,94th Aero Squadron,(7 Reviews),"8885 Balboa Ave, San Diego, CA 92123",(858) 560-6771,45,http://www.94thsandiego.com; http://www.94thsandiego.com; ,,"For over 30 years, one of San Diego's landmark dining destinations and one of the most unique and memorable restaurants you will ever find. Located inside a replica of a World War I French farmhouse decorated with fascinating military memorabilia, antiques, and aviation relics, the restaurant overlooks Montgomery Field Airport, and has a cozy and romantic ambiance, with large stone fireplaces intimate booths, and beautiful views.  The extensive menu features mid-western aged beef and the freshest seafood.  Here you will find USDA Choice & Prime Beef steaks, slow-roasted Angus prime rib, succulent lobster tail,  fresh fish, rack of lamb, veal, chicken, pasta dishes, and fabulous desserts.  Their famous Champagne Brunch is currently the #1 Sunday Brunch in the city on AOL's CityGuide poll and is not to be missed.  Beautiful outdoor patios, a very popular Happy Hour, and excellent banquet facilities help make the 94th Aero Squadron one of the great dining experiences in all of San Diego.",Mon - Thu: 11:00 am - 9:00 pm; Fri: 11:00 am - 11:00 pm; Sat: 4:00 pm - 10:00 pm; Sun: 4:00 pm - 9:00 pm; ,"mastercard, discover","American Restaurants, Banquet Halls & Reception Facilities, Cocktail Lounges, Party Planning, Restaurant Menus, Restaurants, Steak Houses, Wedding Reception Locations & Services, Wedding Supplies & Services ",Banquet Rooms Restaurants,"Kearny Mesa, Eastern San Diego",,"Parking: Lot, Private;Wi-Fi: No;Bike Parking: No;Attire: Casual;Wheelchair Accessible: Yes;Cuisines: American, Steakhouse;Alcohol: Full Bar;Takes Reservations: Yes;Outdoor Seating: Yes;Price Range : Average;"
